{
  "v": 1,
  "slug": "serra-da-saudade-mg",
  "nome": "Serra da Saudade",
  "uf": "MG",
  "cod_tse": 53317,
  "cod_ibge": 3166600,
  "eleitores": 1281,
  "atualizado": "2026-10-25T18:42:10-03:00",
  "secoes_pct": 100,
  "presidente": {
    "cand": [
      {
        "n": 13,
        "nome": "Lula",
        "partido": "PT",
        "votos": 0,
        "pct": 0,
        "eleito": false
      },
      {
        "n": 22,
        "nome": "Flávio Bolsonaro",
        "partido": "PL",
        "votos": 919,
        "pct": 100,
        "eleito": false
      }
    ],
    "variacao_2022": {
      "13": -46.15,
      "22": 46.15
    },
    "diferenca_votos": 919
  },
  "governador": null,
  "selos": [
    "mais_unanime_br"
  ],
  "rank": {
    "dividida_br": 49,
    "dividida_uf": 3,
    "virada_uf": null
  },
  "virou": false
}
